{
  "ip": "198.51.100.42",
  "source_workspaces": [
    "GreyNoise",
    "UserWorkspace"
  ],
  "is_stage_1": false,
  "is_stage_2": false,
  "first_seen": "2025-03-01T00:00:00Z",
  "last_seen": "2025-03-15T12:30:00Z",
  "scanner_ips": [
    "203.0.113.7",
    "192.0.2.99"
  ],
  "scanner_count": 5,
  "file_count": 3,
  "active_files": []
}